{
  "schemaVersion": "5.0.0",
  "candidate": "focused",
  "source": {
    "oxyflutCommit": "0000000000000000000000000000000000000000",
    "flutterFrameworkCommit": "0000000000000000000000000000000000000000",
    "flutterEngineCommit": "0000000000000000000000000000000000000000",
    "candidateCommit": "0000000000000000000000000000000000000000",
    "adapterCommit": "0000000000000000000000000000000000000000"
  },
  "lockDigest": "0000000000000000000000000000000000000000000000000000000000000000",
  "environmentResults": {
    "macos": {
      "CAP-CMP-001": {
        "status": "not-applicable-kk",
        "evidence": [
          {
            "path": "evidence/example.json",
            "sha256": "0000000000000000000000000000000000000000000000000000000000000000",
            "mediaType": "application/json"
          }
        ],
        "notApplicable": {
          "platformBaseline": {
            "path": "platform-contracts.json",
            "sha256": "0000000000000000000000000000000000000000000000000000000000000000",
            "schemaVersion": "5.0.0",
            "specificationVersion": "0.15.0"
          },
          "absentEventId": "ABS-CMP-001"
        }
      },
      "CAP-CMP-002": {
        "status": "pass",
        "evidence": [
          {
            "path": "evidence/example.json",
            "sha256": "0000000000000000000000000000000000000000000000000000000000000000",
            "mediaType": "application/json"
          }
        ],
        "notApplicable": null
      },
      "CAP-CMP-003": {
        "status": "pass",
        "evidence": [
          {
            "path": "evidence/example.json",
            "sha256": "0000000000000000000000000000000000000000000000000000000000000000",
            "mediaType": "application/json"
          }
        ],
        "notApplicable": null
      },
      "CAP-CMP-004": {
        "status": "pass",
        "evidence": [
          {
            "path": "evidence/example.json",
            "sha256": "0000000000000000000000000000000000000000000000000000000000000000",
            "mediaType": "application/json"
          }
        ],
        "notApplicable": null
      },
      "CAP-CMP-005": {
        "status": "pass",
        "evidence": [
          {
            "path": "evidence/example.json",
            "sha256": "0000000000000000000000000000000000000000000000000000000000000000",
            "mediaType": "application/json"
          }
        ],
        "notApplicable": null
      },
      "CAP-CMP-006": {
        "status": "pass",
        "evidence": [
          {
            "path": "evidence/example.json",
            "sha256": "0000000000000000000000000000000000000000000000000000000000000000",
            "mediaType": "application/json"
          }
        ],
        "notApplicable": null
      },
      "CAP-CMP-007": {
        "status": "pass",
        "evidence": [
          {
            "path": "evidence/example.json",
            "sha256": "0000000000000000000000000000000000000000000000000000000000000000",
            "mediaType": "application/json"
          }
        ],
        "notApplicable": null
      },
      "CAP-LAY-001": {
        "status": "pass",
        "evidence": [
          {
            "path": "evidence/example.json",
            "sha256": "0000000000000000000000000000000000000000000000000000000000000000",
            "mediaType": "application/json"
          }
        ],
        "notApplicable": null
      },
      "CAP-LAY-002": {
        "status": "pass",
        "evidence": [
          {
            "path": "evidence/example.json",
            "sha256": "0000000000000000000000000000000000000000000000000000000000000000",
            "mediaType": "application/json"
          }
        ],
        "notApplicable": null
      },
      "CAP-SCR-001": {
        "status": "pass",
        "evidence": [
          {
            "path": "evidence/example.json",
            "sha256": "0000000000000000000000000000000000000000000000000000000000000000",
            "mediaType": "application/json"
          }
        ],
        "notApplicable": null
      },
      "CAP-SCR-002": {
        "status": "pass",
        "evidence": [
          {
            "path": "evidence/example.json",
            "sha256": "0000000000000000000000000000000000000000000000000000000000000000",
            "mediaType": "application/json"
          }
        ],
        "notApplicable": null
      },
      "CAP-REN-001": {
        "status": "pass",
        "evidence": [
          {
            "path": "evidence/example.json",
            "sha256": "0000000000000000000000000000000000000000000000000000000000000000",
            "mediaType": "application/json"
          }
        ],
        "notApplicable": null
      },
      "CAP-REN-002": {
        "status": "pass",
        "evidence": [
          {
            "path": "evidence/example.json",
            "sha256": "0000000000000000000000000000000000000000000000000000000000000000",
            "mediaType": "application/json"
          }
        ],
        "notApplicable": null
      },
      "CAP-REN-003": {
        "status": "pass",
        "evidence": [
          {
            "path": "evidence/example.json",
            "sha256": "0000000000000000000000000000000000000000000000000000000000000000",
            "mediaType": "application/json"
          }
        ],
        "notApplicable": null
      },
      "CAP-AST-001": {
        "status": "pass",
        "evidence": [
          {
            "path": "evidence/example.json",
            "sha256": "0000000000000000000000000000000000000000000000000000000000000000",
            "mediaType": "application/json"
          }
        ],
        "notApplicable": null
      },
      "CAP-AST-002": {
        "status": "pass",
        "evidence": [
          {
            "path": "evidence/example.json",
            "sha256": "0000000000000000000000000000000000000000000000000000000000000000",
            "mediaType": "application/json"
          }
        ],
        "notApplicable": null
      },
      "CAP-AST-003": {
        "status": "pass",
        "evidence": [
          {
            "path": "evidence/example.json",
            "sha256": "0000000000000000000000000000000000000000000000000000000000000000",
            "mediaType": "application/json"
          }
        ],
        "notApplicable": null
      },
      "CAP-AST-004": {
        "status": "pass",
        "evidence": [
          {
            "path": "evidence/example.json",
            "sha256": "0000000000000000000000000000000000000000000000000000000000000000",
            "mediaType": "application/json"
          }
        ],
        "notApplicable": null
      },
      "CAP-VIEW-001": {
        "status": "pass",
        "evidence": [
          {
            "path": "evidence/example.json",
            "sha256": "0000000000000000000000000000000000000000000000000000000000000000",
            "mediaType": "application/json"
          }
        ],
        "notApplicable": null
      },
      "CAP-VIEW-002": {
        "status": "pass",
        "evidence": [
          {
            "path": "evidence/example.json",
            "sha256": "0000000000000000000000000000000000000000000000000000000000000000",
            "mediaType": "application/json"
          }
        ],
        "notApplicable": null
      },
      "CAP-VIEW-003": {
        "status": "pass",
        "evidence": [
          {
            "path": "evidence/example.json",
            "sha256": "0000000000000000000000000000000000000000000000000000000000000000",
            "mediaType": "application/json"
          }
        ],
        "notApplicable": null
      },
      "CAP-VIEW-004": {
        "status": "pass",
        "evidence": [
          {
            "path": "evidence/example.json",
            "sha256": "0000000000000000000000000000000000000000000000000000000000000000",
            "mediaType": "application/json"
          }
        ],
        "notApplicable": null
      },
      "CAP-VIEW-005": {
        "status": "pass",
        "evidence": [
          {
            "path": "evidence/example.json",
            "sha256": "0000000000000000000000000000000000000000000000000000000000000000",
            "mediaType": "application/json"
          }
        ],
        "notApplicable": null
      },
      "CAP-REC-001": {
        "status": "pass",
        "evidence": [
          {
            "path": "evidence/example.json",
            "sha256": "0000000000000000000000000000000000000000000000000000000000000000",
            "mediaType": "application/json"
          }
        ],
        "notApplicable": null
      },
      "CAP-INP-001": {
        "status": "pass",
        "evidence": [
          {
            "path": "evidence/example.json",
            "sha256": "0000000000000000000000000000000000000000000000000000000000000000",
            "mediaType": "application/json"
          }
        ],
        "notApplicable": null
      },
      "CAP-INP-002": {
        "status": "pass",
        "evidence": [
          {
            "path": "evidence/example.json",
            "sha256": "0000000000000000000000000000000000000000000000000000000000000000",
            "mediaType": "application/json"
          }
        ],
        "notApplicable": null
      },
      "CAP-FOC-001": {
        "status": "pass",
        "evidence": [
          {
            "path": "evidence/example.json",
            "sha256": "0000000000000000000000000000000000000000000000000000000000000000",
            "mediaType": "application/json"
          }
        ],
        "notApplicable": null
      },
      "CAP-TXT-001": {
        "status": "pass",
        "evidence": [
          {
            "path": "evidence/example.json",
            "sha256": "0000000000000000000000000000000000000000000000000000000000000000",
            "mediaType": "application/json"
          }
        ],
        "notApplicable": null
      },
      "CAP-TXT-002": {
        "status": "pass",